{
  "$schema": "https://json-schema.org/draft/2020-12/schema",
  "$id": "https://go-bayes.github.io/places-of-worship/schemas/area-summary-columns.v1.schema.json",
  "title": "Area Summary Columnar Transport v1",
  "description": "A derived, download-sized copy of one governed area-summary product (area-summary.v2 or a legacy generation), generated by scripts/build_area_summary_columns.py and never edited by hand. The governed product stays canonical: decoding this file, as {...header, rows}, reproduces that product exactly, and the CI round-trip check enforces it. Every row of the product carries the same keys in the same order; keys lists them. A key whose value is identical on every row is stored once in constants; a key with few distinct values is stored in encoded as the distinct values plus one integer position per row; every other key is stored in columns as one value per row. The three groups partition keys. The map runtime reads this file only where a level's REGION_CONFIG names summaryColumns, and falls back to the governed product on any error.",
  "type": "object",
  "additionalProperties": false,
  "required": ["schema_version", "source_file", "source_sha256", "n", "header", "keys", "constants", "encoded", "columns"],
  "properties": {
    "schema_version": { "const": "area-summary-columns.v1" },
    "source_file": {
      "type": "string",
      "pattern": "^area_summary_[a-z0-9_]+\\.json$",
      "description": "File name of the governed product this file was derived from, in the same directory."
    },
    "source_sha256": {
      "type": "string",
      "pattern": "^[a-f0-9]{64}$",
      "description": "SHA-256 of the governed product's bytes at generation."
    },
    "n": { "type": "integer", "minimum": 1, "description": "Number of rows." },
    "header": {
      "type": "object",
      "description": "Every top-level field of the governed product except rows, verbatim."
    },
    "keys": {
      "type": "array",
      "minItems": 1,
      "items": { "type": "string" },
      "uniqueItems": true,
      "description": "Row keys, in the order each decoded row lists them."
    },
    "constants": {
      "type": "object",
      "description": "Keys whose value is identical on every row."
    },
    "encoded": {
      "type": "object",
      "additionalProperties": {
        "type": "object",
        "additionalProperties": false,
        "required": ["values", "index"],
        "properties": {
          "values": { "type": "array", "description": "Distinct values, in order of first appearance." },
          "index": {
            "type": "array",
            "items": { "type": "integer", "minimum": 0 },
            "description": "One position into values per row."
          }
        }
      }
    },
    "columns": {
      "type": "object",
      "additionalProperties": { "type": "array" },
      "description": "Keys stored as one value per row."
    }
  }
}
