{"schema_version":"area-summary-columns.v1","source_file":"area_summary_county_1850.json","source_sha256":"593a20149deac1d4625d91754f424b47fbf40113c4db3b658c885ebd1a4a2357","n":1626,"header":{"schema_version":"0.2.0","generated_at":"2026-07-06T11:50:49Z","generated_by":"scripts/build_us_nhgis_deep_past.R","country_code":"US","site_snapshot":{"source_dataset_id":null,"snapshot_date":null,"basis":"no OpenStreetMap place-of-worship layer built yet for the US","notes":"this historical-era product carries religious-bodies rates only; place_count and its derived metrics are null."},"boundary_set":{"boundary_set_id":"us-county-1850-tl2008","country_code":"US","level":"county_1850","vintage":"1850","source_dataset_id":"nhgis-shapefile-us-county-1850-tl2008"},"source":{"provider":"IPUMS NHGIS, University of Minnesota","citation":"Jonathan Schroeder, David Van Riper, Steven Manson, Grace Cooper, Zachary Krause, Tracy Kugler, Tsu Zhu, and Steven Ruggles. IPUMS National Historical Geographic Information System: Version 21.0 [dataset]. Minneapolis, MN: IPUMS. 2026. http://doi.org/10.18128/D050.V21.0","short_citation":"IPUMS NHGIS, University of Minnesota, www.nhgis.org.","reuse_note":"Any other re-use of our data should also cite IPUMS NHGIS, and the data should not be further redistributed without permission from IPUMS NHGIS (nhgis@umn.edu). Please see the IPUMS NHGIS Terms of Use: https://www.ipums.org/about/terms.","licence_position":"publish the derived rates with citation and a pointer to the original NHGIS data, now; he judges the risk acceptable for a research website and takes responsibility for it.","licence_confirmation":"IPUMS NHGIS confirmed on 2026-07-14 that publishing these derived county rates conforms with the NHGIS licence (NHGIS user support reply, recorded in research/correspondence/reuse-reply-us-nhgis-2026-07-15.md); the reply asked that the reuse note ship alongside the citation."},"indicators":["population_total","church_seating_per_100_population","churches_or_edifices_per_10000_residents","members_per_100_population"],"notes":"Rows contain derived rates/counts only. The shared map's religious_affiliation_percent metric slot displays church seating per 100 population for 1850-1890, members per 100 population for 1906-1936, and adherents per 100 population for 1952-2020; the US page labels the construct shift explicitly.","waves":[1850]},"keys":["country_code","boundary_set_id","boundary_level","area_unit_id","area_code","area_name","year","population_total","population_total_basis","religious_affiliation_count","religious_affiliation_percent","no_religion_count","no_religion_percent","place_count","places_per_10000_residents","place_density_per_sq_km","land_area_sq_km","site_snapshot_date","place_count_basis","quality_flag","source_dataset_ids"],"constants":{"country_code":"US","boundary_set_id":"us-county-1850-tl2008","boundary_level":"county_1850","year":1850,"population_total_basis":"1850 total county population from NHGIS table NT1 (ADQ001).","no_religion_count":null,"no_religion_percent":null,"place_density_per_sq_km":null,"site_snapshot_date":null,"quality_flag":"wave_coverage_differs","source_dataset_ids":["nhgis-ds10-1850-county","nhgis-shapefile-us-county-1850-tl2008"]},"encoded":{"place_count_basis":{"values":["total number of churches from NHGIS table NT50 (AEX001)",null],"index":[0,0,0,0,0,0,0,0,0,1,0,0,0,0,0,0,0,0,0,0,0,0,0,0,0,0,0,0,0,0,0,0,0,0,0,0,0,0,0,0,0,0,0,0,0,0,0,0,0,0,0,0,0,0,0,0,0,0,0,0,0,0,0,0,0,0,0,0,0,0,0,0,0,0,0,0,0,0,0,0,0,0,0,0,0,0,0,0,0,0,0,0,0,0,0,0,0,0,0,0,0,0,0,0,0,0,0,0,0,0,0,0,0,0,0,0,0,0,0,0,0,0,0,0,0,0,0,0,0,0,0,0,0,0,0,0,0,0,0,0,0,0,0,0,0,0,0,0,0,0,0,0,0,0,0,0,0,0,0,0,0,0,0,0,0,0,0,0,0,0,0,0,0,0,0,0,0,0,0,0,0,0,0,0,0,0,0,0,0,0,0,0,0,0,0,0,0,0,0,0,0,0,0,0,0,0,0,0,0,0,0,0,0,0,0,0,0,0,1,0,0,0,0,0,0,0,0,0,0,0,0,0,0,0,0,0,0,0,0,0,0,0,0,0,0,0,0,0,0,0,0,0,0,0,0,0,0,0,0,0,0,0,0,0,0,0,0,0,0,0,0,0,0,0,0,0,0,0,0,0,0,0,0,0,0,0,0,0,0,0,0,0,0,0,0,0,0,0,0,0,0,0,0,0,0,0,0,0,0,0,0,0,0,0,0,0,0,0,0,0,0,0,0,1,0,0,0,0,0,0,0,0,0,0,0,0,0,0,0,0,0,0,0,0,0,0,0,0,0,0,0,0,0,0,0,0,0,0,0,0,0,0,0,0,0,0,0,0,0,0,0,0,0,0,0,0,0,0,1,0,0,0,0,0,0,0,0,0,0,0,0,0,0,0,0,0,0,0,0,0,0,0,0,0,0,0,0,0,0,0,0,0,0,0,0,0,0,0,0,0,0,0,0,0,0,0,0,0,0,0,0,0,0,0,0,0,0,0,0,0,0,0,0,0,0,0,0,0,0,0,0,0,0,0,0,0,0,0,0,0,0,0,0,0,0,0,0,0,0,0,0,0,0,0,0,0,0,0,0,0,0,0,0,0,0,0,0,0,0,0,0,0,0,0,0,0,0,0,0,0,0,0,0,0,0,0,0,0,0,0,0,0,0,0,0,0,0,0,0,1,0,0,0,0,0,0,0,0,0,0,0,0,0,0,1,0,0,0,0,0,0,0,0,0,0,0,1,0,0,0,0,0,0,0,0,0,0,0,0,0,0,0,0,0,0,0,0,0,0,0,0,0,0,0,0,0,0,0,0,0,0,0,0,0,0,0,0,0,0,0,0,0,0,0,0,0,0,0,0,0,0,0,0,0,0,0,0,0,0,0,0,0,0,0,0,0,0,0,0,0,0,0,0,0,0,0,0,0,0,0,0,0,0,0,0,0,0,0,0,0,0,0,0,0,0,0,0,0,0,0,0,0,0,0,0,0,0,0,0,0,0,0,0,0,0,0,0,0,0,0,0,0,0,0,0,0,0,0,0,0,0,0,1,0,0,0,0,0,0,0,0,0,0,0,0,0,0,0,0,0,0,0,0,0,0,0,0,0,0,0,0,0,0,0,0,0,0,0,0,0,0,0,0,0,0,0,0,0,0,0,0,0,0,0,0,0,0,0,0,0,0,0,0,0,0,0,0,0,0,0,0,0,0,0,0,0,0,0,0,0,0,0,0,0,0,0,0,0,0,0,0,0,0,0,0,0,0,0,0,0,0,0,0,0,0,0,0,0,0,0,0,0,0,0,0,0,0,0,0,0,0,0,0,0,0,0,0,0,0,0,0,0,0,0,0,0,0,0,0,0,0,0,0,0,0,0,0,0,0,0,0,0,0,0,0,0,0,0,0,0,0,0,0,0,0,0,0,0,0,0,0,0,0,0,0,0,0,0,0,0,0,0,0,0,0,0,0,0,0,0,0,0,0,0,0,0,0,0,0,0,0,0,0,0,0,0,0,0,0,0,0,0,0,0,0,0,0,0,0,0,0,0,0,0,0,0,0,0,0,0,0,0,0,0,0,0,0,0,0,0,0,0,0,0,0,0,0,0,0,0,0,0,0,0,0,0,0,0,0,0,0,0,0,0,0,0,0,0,0,0,0,0,0,0,0,0,0,0,0,0,0,0,0,0,0,0,0,0,0,0,0,0,0,0,0,0,0,0,0,0,0,0,0,0,0,0,0,0,0,0,0,0,0,0,0,0,0,0,0,0,0,0,0,0,0,0,0,0,0,0,0,0,0,0,0,0,0,0,0,0,0,0,0,0,0,0,0,0,0,0,0,0,0,0,0,0,0,0,0,0,0,0,0,0,0,0,0,0,0,0,0,0,0,0,0,0,0,0,0,0,0,0,0,0,0,0,0,0,0,0,0,0,0,0,0,0,0,0,0,0,0,0,0,0,0,0,0,0,0,0,0,0,0,0,0,0,0,0,0,0,0,0,0,0,0,0,0,0,0,0,0,0,0,0,0,0,0,0,0,0,0,0,0,0,0,0,0,0,0,0,0,0,0,0,0,0,0,0,0,0,0,0,0,0,0,0,0,0,0,0,0,0,0,0,0,0,0,0,0,0,0,0,0,0,0,0,0,0,0,0,0,0,0,0,0,0,0,0,0,0,0,0,0,0,0,0,0,0,0,0,0,0,0,0,0,0,0,0,0,0,0,0,0,0,0,0,0,0,0,0,0,0,0,0,0,0,0,0,0,0,0,0,0,0,0,0,0,0,0,0,0,0,0,0,0,0,0,0,0,0,0,0,0,0,0,0,0,0,0,0,0,0,0,0,0,0,0,0,0,0,0,0,0,0,1,0,0,0,0,0,0,0,0,0,0,0,0,0,0,0,0,0,0,0,1,0,1,0,0,0,0,0,1,0,0,0,0,0,0,0,1,0,0,0,0,0,0,0,0,0,0,0,0,0,0,0,0,0,0,0,0,0,0,0,0,0,0,0,0,0,0,0,0,0,0,0,0,0,0,0,0,0,0,0,0,0,0,0,0,0,0,0,0,0,0,0,0,0,0,0,0,0,0,0,0,0,0,0,0,0,0,0,0,0,0,0,0,0,0,0,0,0,0,0,0,0,0,0,0,0,0,0,0,0,0,0,0,0,0,0,0,0,0,0,0,0,0,0,0,0,0,0,0,0,0,0,0,0,0,0,0,0,0,0,0,0,0,0,0,0,0,0,0,0,0,0,0,0,0,0,0,0,0,0,0,0,1,0,0,0,0,0,0,0,0,0,0,0,0,0,0,0,0,0,0,0,0,0,0,0,0,0,0,0,0,1,0,0,0,0,0,0,0,0,0,0,0,0,0,0,0,0,0,0,0,0,0,0,0,0,0,0,0,0,0,0,0,0,0,0,0,0,0,0,0,0,0,0,0,0,0,0,0,0,0,0,0,0,0,0,0,0,0,0,0,0,0,0,0,0,0,0,0,0,0,0,0,1,0,0,0,0,0,0,0,0,0,0,0,0,0,0,0,0,0,0,1,0,0,0,0,0,0,0,0,0,0,0,0,0,0,0,0,0,0,0,0,0,0,0,0,0,0,0,0,0,0,0,0,0,0,0,0,0,0,0,0,0,0,0,0,0,0,0,0,0,0,0,0,0,0,0,0,0,0,0]}},"columns":{"area_unit_id":["us-county-1850-tl2008:G4500010","us-county-1850-tl2008:G5100010","us-county-1850-tl2008:G2100010","us-county-1850-tl2008:G2900010","us-county-1850-tl2008:G1700010","us-county-1850-tl2008:G1800010","us-county-1850-tl2008:G2800010","us-county-1850-tl2008:G3900010","us-county-1850-tl2008:G4200010","us-county-1850-tl2008:G5500010","us-county-1850-tl2008:G5000010","us-county-1850-tl2008:G1200010","us-county-1850-tl2008:G3700010","us-county-1850-tl2008:G3600010","us-county-1850-tl2008:G5100030","us-county-1850-tl2008:G1700030","us-county-1850-tl2008:G3700030","us-county-1850-tl2008:G5100035","us-county-1850-tl2008:G1900050","us-county-1850-tl2008:G2600050","us-county-1850-tl2008:G2400010","us-county-1850-tl2008:G3600030","us-county-1850-tl2008:G5100050","us-county-1850-tl2008:G4200030","us-county-1850-tl2008:G1800030","us-county-1850-tl2008:G2100030","us-county-1850-tl2008:G3900030","us-county-1850-tl2008:G5100070","us-county-1850-tl2008:G5100090","us-county-1850-tl2008:G2800050","us-county-1850-tl2008:G2100050","us-county-1850-tl2008:G4500070","us-county-1850-tl2008:G4700010","us-county-1850-tl2008:G4800010","us-county-1850-tl2008:G2900030","us-county-1850-tl2008:G4800050","us-county-1850-tl2008:G2400030","us-county-1850-tl2008:G3700070","us-county-1850-tl2008:G1900070","us-county-1850-tl2008:G1300010","us-county-1850-tl2008:G5100110","us-county-1850-tl2008:G0500010","us-county-1850-tl2008:G4200050","us-county-1850-tl2008:G2300030","us-county-1850-tl2008:G2200050","us-county-1850-tl2008:G3700090","us-county-1850-tl2008:G3900050","us-county-1850-tl2008:G0500030","us-county-1850-tl2008:G3900070","us-county-1850-tl2008:G2200070","us-county-1850-tl2008:G2900050","us-county-1850-tl2008:G3900090","us-county-1850-tl2008:G3400010","us-county-1850-tl2008:G2800070","us-county-1850-tl2008:G2900070","us-county-1850-tl2008:G3900110","us-county-1850-tl2008:G5100150","us-county-1850-tl2008:G4800150","us-county-1850-tl2008:G0100010","us-county-1850-tl2008:G2200090","us-county-1850-tl2008:G1300070","us-county-1850-tl2008:G0100030","us-county-1850-tl2008:G1300090","us-county-1850-tl2008:G2100070","us-county-1850-tl2008:G2400050","us-county-1850-tl2008:G0100050","us-county-1850-tl2008:G5100155","us-county-1850-tl2008:G2500010","us-county-1850-tl2008:G4500110","us-county-1850-tl2008:G2100090","us-county-1850-tl2008:G2600150","us-county-1850-tl2008:G2900090","us-county-1850-tl2008:G1800050","us-county-1850-tl2008:G4800210","us-county-1850-tl2008:G2900130","us-county-1850-tl2008:G2100110","us-county-1850-tl2008:G5100170","us-county-1850-tl2008:G3700130","us-county-1850-tl2008:G4500130","us-county-1850-tl2008:G4200070","us-county-1850-tl2008:G4200090","us-county-1850-tl2008:G4700030","us-county-1850-tl2008:G5100190","us-county-1850-tl2008:G3300010","us-county-1850-tl2008:G3900130","us-county-1850-tl2008:G5000030","us-county-1850-tl2008:G0100055","us-county-1850-tl2008:G0500070","us-county-1850-tl2008:G1200065","us-county-1850-tl2008:G1800070","us-county-1850-tl2008:G1900110","us-county-1850-tl2008:G2750015","us-county-1850-tl2008:G2900150","us-county-1850-tl2008:G4130015","us-county-1850-tl2008:G4700050","us-county-1850-tl2008:G3400030","us-county-1850-tl2008:G5100195","us-county-1850-tl2008:G4200110","us-county-1850-tl2008:G2500030","us-county-1850-tl2008:G3550035","us-county-1850-tl2008:G2600210","us-county-1850-tl20